{
 "claimcheck": "0.1",
 "created_at": "2026-10-02T13:03:38.966Z",
 "run": {
  "adapter": "hermes",
  "adapter_version": "0.1.0",
  "session_id": "ci-dogfood-github",
  "agent": {
   "platform": "hermes",
   "model": "qwen3.8-flash-next"
  },
  "started_at": "2026-09-26T20:32:28.619Z",
  "ended_at": "2026-09-26T21:31:59.271Z",
  "asked": "Review: See where mistakes happened, if you fixed them, and if not patch the sk\u2026",
  "title": "ci dogfood: synthetic receipt with a contradicted claim"
 },
 "capture": {
  "mode": "at-rest",
  "events": 59,
  "hash_alg": "sha256",
  "redaction": "claimcheck-redact-v1"
 },
 "ledger": {
  "tool_calls": 59,
  "by_tool": {
   "skill_view": 5,
   "terminal": 19,
   "read_file": 5,
   "vision_analyze": 3,
   "skill_manage": 4,
   "execute_code": 10,
   "patch": 12,
   "search_files": 1
  },
  "commands": {
   "total": 29,
   "failed": 1,
   "remote": 7,
   "items": [
    {
     "i": 4,
     "text": "ls",
     "exit_code": 0,
     "ts": "2026-09-26T20:32:55.210Z",
     "sha256": "912e537bfe06ffcf495af47961eae7c2fcd72d55608b4f0146f17c2e4b153cda"
    },
    {
     "i": 5,
     "text": "find",
     "exit_code": 0,
     "ts": "2026-09-26T20:32:59.347Z",
     "sha256": "ca3300fd642ad22acc62ddf962cdf0951dda466bdb1ef0ee1edef8e1409e7db9"
    },
    {
     "i": 11,
     "text": "cd",
     "exit_code": 0,
     "ts": "2026-09-26T20:34:03.094Z",
     "sha256": "5e4ac675258db3945ae838cedf30ee6ff5a1192d785154e98a866e470a5429fc"
    },
    {
     "i": 12,
     "text": "which",
     "exit_code": 0,
     "ts": "2026-09-26T20:34:57.177Z",
     "sha256": "e18413313714fa2f5c33d872ad0777893872dbe13c9a95ca7124a58da22ee82f"
    },
    {
     "i": 15,
     "text": "cd",
     "exit_code": 0,
     "ts": "2026-09-26T20:41:08.147Z",
     "sha256": "8864fe3e93b6f46de827f911c747d4d7c0d61562d29c6abac31b9122e2f8f500"
    },
    {
     "i": 16,
     "text": "cd",
     "exit_code": 0,
     "ts": "2026-09-26T20:44:48.692Z",
     "remote": true,
     "sha256": "61219bb2e02388e59e3283f1916d2f5d48ba41c0d9ff84603eb07194333327fa"
    },
    {
     "i": 17,
     "text": "cd",
     "exit_code": 0,
     "ts": "2026-09-26T20:44:55.503Z",
     "remote": true,
     "sha256": "589f1bd0fd6cefa036f8f66c31aa488d9844dc2d9ea745e174a5d9263f26b848"
    },
    {
     "i": 20,
     "text": "from",
     "exit_code": 0,
     "ts": "2026-09-26T20:52:21.111Z",
     "sha256": "e957e49dd61619c1903de16b48b039bd81b056d292532c28b0778e639782ee8d"
    },
    {
     "i": 22,
     "text": "cat",
     "exit_code": 0,
     "ts": "2026-09-26T20:54:01.194Z",
     "remote": true,
     "sha256": "4f24a73e1c165dfb545c9da877e01dc285838a44d3f0aa690a8558786b6c784d"
    },
    {
     "i": 30,
     "text": "cd",
     "exit_code": 0,
     "ts": "2026-09-26T21:02:20.441Z",
     "sha256": "a73ef10abfd2708c37c1c725c6746cdf199fd186973080e71468d68fd98d43c4"
    },
    {
     "i": 32,
     "text": "timeout",
     "exit_code": 0,
     "ts": "2026-09-26T21:03:08.702Z",
     "remote": true,
     "sha256": "2998d8ebf73078a5d11483c8c0618ebd903fdf61034786cc8440d740ab5dc31e"
    },
    {
     "i": 33,
     "text": "import",
     "exit_code": 1,
     "ts": "2026-09-26T21:05:13.665Z",
     "sha256": "50401e57faa4c9ea76a8995a942d41d891ebaf8a6cf915d45e1221d2a319ab8a"
    },
    {
     "i": 34,
     "text": "import",
     "exit_code": 0,
     "ts": "2026-09-26T21:05:33.772Z",
     "sha256": "4716b2e6c3df28ac7465a21d47118598ec778e15ab0ae5b36972cb5e00780817"
    },
    {
     "i": 35,
     "text": "import",
     "exit_code": 0,
     "ts": "2026-09-26T21:06:53.052Z",
     "sha256": "d8c18b6d9412ddec1f1897e25706e7e3b39302667322ec46c586bd6d5e7b04cc"
    },
    {
     "i": 36,
     "text": "#",
     "exit_code": 0,
     "ts": "2026-09-26T21:08:32.448Z",
     "sha256": "dc61eafdc8e960721f2b43e0f1d58ec14733a97d25635763af049aa79ca24dcc"
    },
    {
     "i": 38,
     "text": "cd",
     "exit_code": 0,
     "ts": "2026-09-26T21:12:49.383Z",
     "sha256": "1a1014d362d858b302232b7a836957149128414fb3f05093ceab38d786683fcb"
    },
    {
     "i": 39,
     "text": "#",
     "exit_code": 0,
     "ts": "2026-09-26T21:13:06.653Z",
     "sha256": "461444a64958222e39e2f58fef96e62944c2e54211dd722473155c98f0e7104f"
    },
    {
     "i": 40,
     "text": "#",
     "exit_code": 0,
     "ts": "2026-09-26T21:14:04.642Z",
     "sha256": "c265161899cddc397ff39a62c6475c0dcd506aa8e970f4b80056554f78dd8f31"
    },
    {
     "i": 42,
     "text": "cd",
     "exit_code": 0,
     "ts": "2026-09-26T21:15:58.498Z",
     "sha256": "0b7ea5124754c1f2408732d472ce9cfbedba18cd1e56c28ec44b59afa6658023"
    },
    {
     "i": 43,
     "text": "import",
     "exit_code": 0,
     "ts": "2026-09-26T21:16:15.580Z",
     "sha256": "0c9b6e34dc5c39f43520e465c01547f60f0d7254b88326c6aadd928896807430"
    },
    {
     "i": 46,
     "text": "cd",
     "exit_code": 0,
     "ts": "2026-09-26T21:19:54.835Z",
     "sha256": "9fce196cc89114de45fd7025bc7b94ff60c1c46128443dfeb1727d934c1da010"
    },
    {
     "i": 47,
     "text": "cd",
     "exit_code": 0,
     "ts": "2026-09-26T21:20:04.057Z",
     "sha256": "72bad287d7ebe78d06139552b7cd81663816fb2f26530067b44fc5ec67f0d46d"
    },
    {
     "i": 48,
     "text": "#",
     "exit_code": 0,
     "ts": "2026-09-26T21:20:27.180Z",
     "sha256": "93f00f9459bd6a75bbad5a797fb8090750c46d32870a6610c465b2b12e6b9551"
    },
    {
     "i": 51,
     "text": "cd",
     "exit_code": 0,
     "ts": "2026-09-26T21:24:33.603Z",
     "sha256": "597d07134c3e7bb1e0294b7fd506c1b6fa53c7bc6fdb2300eb5ba6c18d402fdf"
    },
    {
     "i": 52,
     "text": "import",
     "exit_code": 0,
     "ts": "2026-09-26T21:25:21.048Z",
     "sha256": "298897be5d694646c9223a893530d34357147864556a96927893375320292f33"
    },
    {
     "i": 54,
     "text": "cat",
     "exit_code": 0,
     "ts": "2026-09-26T21:26:59.226Z",
     "remote": true,
     "sha256": "399647bee2647fe99edb6edc5093fd87b1738d1df334ca25614aa337457ea1a7"
    },
    {
     "i": 55,
     "text": "cd",
     "exit_code": 0,
     "ts": "2026-09-26T21:27:04.315Z",
     "sha256": "a1a8e9efec0e0fcb20cca44491d38a1cc94292b8a21dde98a8425e30c8c7002a"
    },
    {
     "i": 56,
     "text": "for",
     "exit_code": 0,
     "ts": "2026-09-26T21:27:59.716Z",
     "remote": true,
     "sha256": "84f89546b99d1a9cc8967282ec0b7459835fc8c37e28ed0fb77e42c977027eed"
    },
    {
     "i": 57,
     "text": "for",
     "exit_code": 0,
     "ts": "2026-09-26T21:28:05.520Z",
     "remote": true,
     "sha256": "76b2c664d92447555c2fff02ac5f1838990141b844f3a81425a7f6ddb714f790"
    }
   ]
  },
  "files": {
   "written": [
    "main.gd",
    "skill:doodle-sprite-generator",
    "skill:godot-game-dev"
   ],
   "read": [
    "SKILL.md",
    "api.md",
    "export_presets.cfg",
    "gen_assets.py",
    "main.gd",
    "main.tscn",
    "project.godot"
   ]
  },
  "external": 0,
  "usage": {
   "input_tokens": 149316,
   "output_tokens": 121863,
   "reasoning_tokens": 106763
  }
 },
 "report": {